{
  "$schema": "../schemas/local_memory_system.v1.schema.json",
  "schema_version": "local_memory_system.v1",
  "generated_at": "2026-05-31",
  "selected_plan": {
    "id": "contract-governed-local-memory",
    "name": "本地合同治理记忆系统",
    "status": "selected",
    "rationale": "本地仓继续作为源规则层，记忆只通过本地 schema、envctl validator、日报、演化待办、Obsidian/Zotero/Git 记录和用户确认沉淀；external_memory_service 已评估但当前不作为常驻运行态适配器。"
  },
  "design_principles": [
    "记忆先成为候选，再决定是否沉淀。",
    "越用越顺手依靠可验证的偏好、纠错和项目复盘，不依靠无边界吞 transcript。",
    "源规则层在本地 Git 仓；运行态缓存只能派生，不能解释或覆盖规则。",
    "自动落地只处理低风险、可回滚、有日志、有校验的动作。",
    "默认不启用外部记忆常驻服务；记忆先进入本地候选、评分、复盘和验证流程。",
    "默认不开启 LLM 压缩、自动上下文注入、全量 transcript 导入和自动规则写入。",
    "代码结构上下文由 codegraph 索引辅助，不替代 rg、validator、代码审查和 Git 历史。",
    "后台服务必须有健康检查、端口边界、数据目录边界和可停止/可删除路径。",
    "线程中的稳定偏好、纠错和 skill 进化信号先进入 thread-memory-intake 报告，再由日报、演化待办、校验器和 Git 决定是否沉淀到全局环境。"
  ],
  "external_inputs": [
    {
      "repo": "384961890-ui/Brain-v1.2.0",
      "decision": "adapt",
      "absorbed_patterns": [
        "healthcheck and stats as first-class status outputs",
        "store/recall/list/forget style tool surface naming",
        "file lock and stale lock awareness for future long-running tools"
      ],
      "rejected_patterns": [
        "Brain MCP as a second memory authority",
        "LanceDB or QMD runtime as a default dependency",
        "destructive forget/cleanup tools without explicit confirmation"
      ]
    },
    {
      "repo": "yyy-yq1/vector-memory-system",
      "decision": "watch",
      "absorbed_patterns": [
        "quality filters before memory admission",
        "heat, occurrence, age and decay metadata",
        "BM25 plus semantic plus RRF as a future optional retrieval idea"
      ],
      "rejected_patterns": [
        "Qdrant or embedding service as a default runtime",
        "automatic transcript ingestion",
        "identity or soul layer as research-environment source truth"
      ]
    },
    {
      "repo": "qslowprofile/OpenClaw-memory-knowledge-Management",
      "decision": "adapt",
      "absorbed_patterns": [
        "persist/private/ephemeral memory policy",
        "formation mode and trust tier metadata",
        "last-status and probe-style self-check reports"
      ],
      "rejected_patterns": [
        "startup hook that writes user-level directories",
        "monolithic migration script as local environment core",
        "automatic repair that mutates source rules without validation"
      ]
    },
    {
      "repo": "external-memory-service-pattern",
      "decision": "watch",
      "absorbed_patterns": [
        "persistent memory as an optional reference pattern, not a default runtime",
        "smart search, session history, audit, export, and governance delete as interface ideas",
        "privacy-first defaults that strip secrets and keep compression/context injection opt-in",
        "health endpoints and viewer-style observability as future optional ideas"
      ],
      "rejected_patterns": [
        "making external_memory_service the source-of-truth rule engine",
        "default Codex lifecycle hooks that run on every session, prompt, and tool use",
        "external_memory_service MCP as a prestarted default server",
        "full transcript import as a default behavior",
        "enabling LLM compression, automatic prompt injection, or prompt rewriting without explicit review",
        "storing secrets, cookies, captcha states, account details, or private project facts as global memory"
      ]
    }
  ],
  "memory_layers": [
    {
      "id": "ephemeral_session",
      "purpose": "本轮任务的临时路径、失败命令、网页状态和短期上下文。",
      "default_target": "discard",
      "ttl_days": 7,
      "auto_promotion_allowed": false
    },
    {
      "id": "project_memory",
      "purpose": "项目事实、阶段、材料边界和项目内证据链。",
      "default_target": "obsidian",
      "ttl_days": null,
      "auto_promotion_allowed": false
    },
    {
      "id": "private_preference",
      "purpose": "用户协作偏好、语言偏好和仅指向源规则的入口提示。",
      "default_target": "codex_native",
      "ttl_days": 90,
      "auto_promotion_allowed": false
    },
    {
      "id": "procedural_memory",
      "purpose": "可复用流程、路由修正规则、工具调用顺序和质量清单。",
      "default_target": "skill",
      "ttl_days": null,
      "auto_promotion_allowed": false
    },
    {
      "id": "control_memory",
      "purpose": "会改变总路由、权限、验证逻辑或稳定性指标的底层规则。",
      "default_target": "control_kernel",
      "ttl_days": null,
      "auto_promotion_allowed": false
    },
    {
      "id": "discarded_noise",
      "purpose": "一次性噪声、无证据断言、过时路径、泄密风险项和重复低价值内容。",
      "default_target": "discard",
      "ttl_days": 1,
      "auto_promotion_allowed": false
    }
  ],
  "candidate_pipeline": {
    "steps": [
      "capture",
      "normalize",
      "score",
      "route",
      "review_or_promote",
      "decay_or_forget",
      "correction"
    ],
    "default_candidate_status": "candidate",
    "promotion_rules": [
      "用户明确说以后都这样，才可提高 user_confirmed。",
      "同一模式至少两次跨任务出现，才可从临时信号进入候选。",
      "进入 skill 前必须有最小测试或明确人工确认。",
      "进入 control_kernel 前必须通过 envctl validate cybernetics。",
      "正式学术引用、论文事实和 DOI 不进入普通记忆，必须走 citation gate。"
    ],
    "hard_block_rules": [
      "包含 secret、token、cookie、账号细节或验证码状态。",
      "把私有内容写入 Git 源仓。",
      "把一次性聊天噪声写成全局规则。",
      "与 AGENTS、control kernel、citation gate 或 protected runtime paths 冲突。",
      "未核验论文事实试图进入正式引用链。"
    ]
  },
  "retrieval_policy": {
    "enabled_interfaces": [
      "keyword_search",
      "semantic_search_optional_dry_run",
      "cross_session_context_injection_gated",
      "confidence_evaluation",
      "decision_archive",
      "task_tracking",
      "memory_cleanup",
      "conversation_snapshot",
      "task_status",
      "memory_list_delete",
      "codegraph_context_index",
      "thread_memory_intake"
    ],
    "default_retrieval_order": [
      "current_project_truth_sources",
      "active_route_and_stage_state",
      "decision_archive",
      "keyword_search",
      "optional_semantic_search_dry_run",
      "codegraph_context_index"
    ],
    "cross_session_injection_policy": [
      "inject only compact summaries, source refs, confidence, and route-stage state",
      "never inject raw full transcripts by default",
      "when route is ambiguous, use injected context only to ask better questions, not to silently switch routes",
      "private or project-specific memories must not become global rules without user confirmation and validator support"
    ],
    "confidence_policy": [
      "every recalled memory must expose source type, age, occurrence count, and confidence band",
      "low-confidence recall should produce a clarification question instead of an automatic action",
      "conflicting memories are routed to decision_archive review rather than merged silently"
    ],
    "task_state_policy": [
      "track current route, lifecycle stage, open blockers, last verified gate, and next recommended stage",
      "task status can guide prompts but cannot override research_pipeline_stages or quality gates",
      "completed project lessons enter evolution_backlog or Obsidian through project-retrospective-evolver"
    ],
    "cleanup_policy": [
      "support list and delete for candidate memories and status reports",
      "expire ephemeral session memories by ttl unless promoted through review",
      "cleanup must preserve git history, validator logs, and protected path records"
    ],
    "interface_controls": [
      {
        "interface": "confidence_evaluation",
        "purpose": "给每条被召回的记忆标明可信度，避免把弱记忆直接当规则使用。",
        "required_fields": [
          "source_ref",
          "source_type",
          "confidence_band",
          "occurrence_count",
          "recency",
          "conflict_status"
        ],
        "safety_rules": [
          "low confidence must ask a clarification question",
          "conflicting recall must enter decision_archive instead of being merged silently"
        ],
        "failure_behavior": "If confidence metadata is missing, treat the recall as a candidate hint only."
      },
      {
        "interface": "decision_archive",
        "purpose": "记录路线选择、规则升格、拒绝和回滚理由，形成可审计决策档案。",
        "required_fields": [
          "decision_id",
          "route_id",
          "source_ref",
          "decision",
          "reason",
          "validator_gate",
          "timestamp"
        ],
        "safety_rules": [
          "durable rule changes must reference a decision record",
          "rejected or conflicting memories must stay visible for review"
        ],
        "failure_behavior": "If no decision record exists, do not promote runtime memory into source rules."
      },
      {
        "interface": "task_tracking",
        "purpose": "记录当前任务链条的开始、暂停、完成、转入下一阶段等状态变化。",
        "required_fields": [
          "task_id",
          "route_id",
          "current_stage",
          "event",
          "timestamp",
          "next_action"
        ],
        "safety_rules": [
          "task tracking is observational and cannot silently start a new route",
          "new chain creation should ask the user for confirmation when intent is ambiguous"
        ],
        "failure_behavior": "If task tracking is absent, continue with current context and ask before opening a new chain."
      },
      {
        "interface": "task_status",
        "purpose": "保存当前路线、研究阶段、阻塞点和下一步建议，帮助新线程快速续接。",
        "required_fields": [
          "route_id",
          "lifecycle_stage",
          "last_verified_gate",
          "open_blockers",
          "next_recommended_stage"
        ],
        "safety_rules": [
          "task status can guide prompts but cannot override pipeline gates",
          "stage transition should ask the user when the intent is ambiguous"
        ],
        "failure_behavior": "If task status is missing, ask the user to confirm the current route and stage."
      },
      {
        "interface": "memory_cleanup",
        "purpose": "支持候选记忆、状态报告和运行态记忆的清理，避免越用越重。",